{
  "schema_version": "1.0",
  "policy_id": "motionloom-ephemeral-ci-policy",
  "trust_domain": "https://motionloom.dev/trust/ci-ephemeral",
  "keys": [
    {
      "key_id": "motionloom-ci-phase2",
      "algorithm": "ed25519",
      "public_key_base64": "+smohFxIgX7glDbL24cMMLlUQwe/4Y0Pd5UgGPrUzU0=",
      "status": "active",
      "valid_from": "2026-08-13T14:08:09.313181Z"
    }
  ],
  "rotation": {
    "max_key_age_days": 1,
    "overlap_days": 0,
    "require_active_signer": true
  },
  "revocation": {
    "mode": "local-policy",
    "fail_closed": true,
    "sources": [
      "ci-ephemeral"
    ]
  }
}
